{
  "kind": "continuity-receipt-verification",
  "version": 1,
  "bundle_digest": "sha256:25ba092ebace0856e605cba0972fd669d1ce70d3423939abe9dba1b8edba03ed",
  "verdict": "TRUSTED",
  "error_codes": [],
  "verified_at": "2026-09-23T21:00:00Z",
  "verifier": {
    "implementation": "python-reference",
    "version": "0.3.2"
  },
  "issuer": "did:key:z6MkfvFqL6qMAgXLopHUAKn1E4Mwf2HLwSrP6eTcu5vnfZZK",
  "sig": {
    "alg": "ed25519",
    "key": "did:key:z6MkfvFqL6qMAgXLopHUAKn1E4Mwf2HLwSrP6eTcu5vnfZZK",
    "value": "eS-kf1DBWcVJeM_CZJl_pNKB0UEirBo_jldBOEiJLvnRonmrqYMYbRXL7vAmPMvdLYUJ7CFxWibZoBwDUKudAw"
  }
}
